{
  "schema_version": "1",
  "generated_at": "2026-07-11T12:00:00Z",
  "guild_id": "987654321098765432",
  "max_depth": 3,
  "biomes": ["Surface", "Cavern", "the Deep", "the Magma core"],
  "miners": [
    {
      "suid": "100000000000000001",
      "guild_id": "987654321098765432",
      "display_name": "DeepDelver",
      "depth": 3,
      "record_depth": 3,
      "position": {"x": 4, "y": -2},
      "energy": {"current": 41, "updated_at": 1783728000},
      "coins": 18450,
      "xp": {"game": "mining", "game_total": 6240, "shared_total": 9310, "level": 14},
      "equipment": {"tool": "diamond pickaxe", "light": "diamond lantern", "charm": "lucky charm"},
      "gear_wear": {"diamond pickaxe": 58, "diamond lantern": 22},
      "mining_inventory": {"stone": 42, "iron": 63, "silver": 38, "gold": 21, "diamond": 9, "wood": 15, "torch": 3, "ration": 2},
      "vault": {"gold": 120, "diamond": 34, "silver": 76},
      "vault_level": 3,
      "skills": {"mining": 4, "luck": 2},
      "structures": {"forge": 3, "home": 1, "campfire": 1}
    },
    {
      "suid": "100000000000000002",
      "guild_id": "987654321098765432",
      "display_name": "SilverSeeker",
      "depth": 2,
      "record_depth": 2,
      "position": {"x": -1, "y": 3},
      "energy": {"current": 60, "updated_at": 1783728000},
      "coins": 7320,
      "xp": {"game": "mining", "game_total": 3180, "shared_total": 4425, "level": 9},
      "equipment": {"tool": "gold pickaxe", "light": "lantern"},
      "gear_wear": {"gold pickaxe": 31},
      "mining_inventory": {"stone": 88, "bronze": 24, "iron": 41, "silver": 27, "wood": 30, "lantern": 1, "energy drink": 1},
      "vault": {"silver": 52, "gold": 11},
      "vault_level": 1,
      "skills": {"mining": 2, "endurance": 1},
      "structures": {"forge": 2, "campfire": 1}
    },
    {
      "suid": "100000000000000003",
      "guild_id": "987654321098765432",
      "display_name": "CavernCrawler",
      "depth": 1,
      "record_depth": 2,
      "position": {"x": 0, "y": 0},
      "energy": {"current": 12, "updated_at": 1783727400},
      "coins": 2140,
      "xp": {"game": "mining", "game_total": 1490, "shared_total": 2010, "level": 6},
      "equipment": {"tool": "iron pickaxe", "light": "torch"},
      "gear_wear": {"iron pickaxe": 9, "torch": 3},
      "mining_inventory": {"stone": 130, "bronze": 33, "iron": 12, "wood": 44, "torch": 6, "cooked fish": 2},
      "vault": {"iron": 25},
      "vault_level": 0,
      "skills": {"mining": 1},
      "structures": {"campfire": 1}
    },
    {
      "suid": "100000000000000004",
      "guild_id": "987654321098765432",
      "display_name": "PebblePicker",
      "depth": 0,
      "record_depth": 1,
      "position": {"x": 2, "y": 1},
      "energy": {"current": 55, "updated_at": 1783728000},
      "coins": 480,
      "xp": {"game": "mining", "game_total": 320, "shared_total": 410, "level": 2},
      "equipment": {"tool": "pickaxe"},
      "gear_wear": {"pickaxe": 14},
      "mining_inventory": {"stone": 37, "bronze": 4, "wood": 9, "pickaxe": 1},
      "vault": {},
      "vault_level": 0,
      "skills": {},
      "structures": {}
    },
    {
      "suid": "100000000000000005",
      "guild_id": "987654321098765432",
      "display_name": "MagmaMaven",
      "depth": 3,
      "record_depth": 3,
      "position": {"x": -6, "y": -6},
      "energy": {"current": 2, "updated_at": 1783727000},
      "coins": 25990,
      "xp": {"game": "mining", "game_total": 5810, "shared_total": 11240, "level": 16},
      "equipment": {"tool": "diamond pickaxe", "light": "diamond lantern", "charm": "lucky charm", "helmet": "iron helmet"},
      "gear_wear": {"diamond pickaxe": 3, "diamond lantern": 47},
      "mining_inventory": {"stone": 12, "gold": 44, "diamond": 17, "dynamite": 2, "ration": 5},
      "vault": {"diamond": 61, "gold": 203, "silver": 40, "iron": 88},
      "vault_level": 4,
      "skills": {"mining": 5, "luck": 3, "endurance": 2},
      "structures": {"forge": 4, "home": 2, "campfire": 1, "dock": 1}
    }
  ]
}
